{
  "schema_version": "pa_feitian_snapshot_v1",
  "generated_at_utc": "2026-07-07T00:00:00Z",
  "source_commit": "cccccccccccccccccccccccccccccccccccccccc",
  "run_config": {
    "contract": "pa_feitian_snapshot_v1",
    "mode": "scorecard",
    "producer": "src/scripts/emit_pa_feitian_snapshot.py",
    "source_scorecard": "src/tests/fixtures/pa_feitian_scorecard_v1.json",
    "pool": "CN_METAL",
    "instrument_class": "cn_metal_futures",
    "window_days": 30,
    "active_rules": [
      "pa-h2-cn-metal"
    ],
    "iv_warmup": 1,
    "iv_max_rank": 0.66,
    "max_signals": null
  },
  "data_quality": {
    "raw_data_access": "not_used_by_pa_feitian_producer",
    "source_output_type": "score_today_json",
    "source_records_total": 3,
    "source_records_with_options": 3,
    "selected_option_price_sources": {
      "model": 1,
      "store": 2
    },
    "selected_option_missing_price": 0,
    "selected_option_missing_iv_or_rank": 1
  },
  "summary": {
    "signals_total": 3,
    "by_status": {
      "keep": 1,
      "data_blocked": 1,
      "model_dominated": 1
    },
    "by_instrument": {
      "SHFE.au": 3
    },
    "integration_milestone": "producer_scorecard_to_pa_feitian_snapshot"
  },
  "signals": [
    {
      "id": "paft_scorecard_0001_kq_m_shfe_au_20260628000000",
      "instrument": "SHFE.au",
      "contract": "kq_m_shfe_au",
      "interval": "1d",
      "ts_utc": "2026-06-28T00:00:00Z",
      "underlying_signal": {
        "family": "pa_feitian",
        "source": "score_today",
        "symbol": "kq_m_shfe_au",
        "direction": "bottom",
        "level": "pa_h2",
        "subtype": "pa_h2",
        "confidence": 0.75,
        "score": 4,
        "policy_rule": "pa-h2-cn-metal-tr-phase",
        "policy_weight": 0.75,
        "matched_sweet_spots": [],
        "direction_verdict": null,
        "direction_confidence": null,
        "direction_sources": null,
        "direction_rationale": null
      },
      "features_det": {
        "lookahead_free": true,
        "cutoff_ts_utc": "2026-06-28T00:00:00Z",
        "source_record_index": 1,
        "underlying_price": 860.0,
        "invalidation_level": null,
        "position_size": "half",
        "pa_isolated": null,
        "pa_phase": "TR",
        "pa_15m_confirmed": null,
        "signal_bar_quality": {
          "body_frac": 0.82,
          "close_pos": 0.97,
          "double_strong": true
        },
        "options_calls": [
          {
            "rank": 1,
            "strike": 880,
            "otm_pct": 2.33,
            "expiry_month": "2608",
            "expiry_date": "2026-08-17",
            "contract_sym": "au2608c880",
            "days_to_expiry": 45,
            "is_mm_strike": false,
            "option_price": 18.5,
            "price_source": "store",
            "model_dominated": false,
            "iv": 20.0
          }
        ],
        "selected_option_contract": "au2608c880"
      },
      "decision": "watch",
      "decision_trace": "score_today:pa_h2 score=4 policy=pa-h2-cn-metal-tr-phase selected=au2608c880 status=data_blocked iv=iv_warmup(<1 prior signals)",
      "option_leg": {
        "side": "call",
        "strike": 880.0,
        "dte": 45,
        "otm_rank": 1,
        "delta_estimate": null,
        "selection_status": "data_blocked"
      },
      "iv_regime": {
        "iv_rank": null,
        "keep": false,
        "reason": "iv_warmup(<1 prior signals)"
      },
      "exit_policy": {
        "mode": "runner",
        "status": "data_blocked",
        "reason": "runner policy retained for review; final action blocked by status"
      },
      "underlying_r_outcome": {
        "available": false,
        "reason": "live_snapshot_no_forward_underlying_outcome"
      },
      "premium_r_outcome": {
        "available": false,
        "reason": "live_snapshot_no_forward_premium_outcome",
        "entry_price": 18.5,
        "price_source": "store",
        "selected_contract": "au2608c880"
      },
      "option_runner_outcome": null,
      "proxy_outcome": null,
      "status": "data_blocked",
      "caveats": [
        "source record is date-granular; ts_utc uses start-of-day UTC",
        "premium entry or causal IV rank is unavailable in source scorecard"
      ],
      "decision_trace_v1": {
        "trace_version": "decision_trace_v1",
        "action": "watch",
        "status": "data_blocked",
        "summary": {
          "headline": "underlying signal accepted; causal IV rank blocked",
          "primary_blocker": "iv_rank_missing",
          "selected_option_contract": "au2608c880",
          "confidence": 0.75
        },
        "input_refs": [
          {
            "id": "scorecard_record:1",
            "kind": "scorecard_record",
            "source": "score_today_json",
            "record_index": 1,
            "asof_ts_utc": "2026-06-28T00:00:00Z",
            "digest": "sha256:27dced3aa613b6b2555f45708b553f9e8be342061ef4fc75dd6681b4163592b1"
          }
        ],
        "nodes": [
          {
            "id": "underlying_signal",
            "kind": "signal",
            "label": "Score Today underlying signal",
            "status": "pass",
            "decision_effect": "promote",
            "reason": "source scorecard emitted an option candidate",
            "evidence": [
              {
                "key": "score",
                "value": 4,
                "source_ref": "scorecard_record:1"
              },
              {
                "key": "direction",
                "value": "bottom",
                "source_ref": "scorecard_record:1"
              },
              {
                "key": "level",
                "value": "pa_h2",
                "source_ref": "scorecard_record:1"
              }
            ]
          },
          {
            "id": "policy_rule",
            "kind": "policy",
            "label": "PA / Feitian policy rule",
            "status": "pass",
            "decision_effect": "promote",
            "reason": "source scorecard supplied a policy rule",
            "evidence": [
              {
                "key": "policy_rule",
                "value": "pa-h2-cn-metal-tr-phase",
                "source_ref": "scorecard_record:1"
              },
              {
                "key": "policy_weight",
                "value": 0.75,
                "source_ref": "scorecard_record:1"
              }
            ]
          },
          {
            "id": "option_selection",
            "kind": "selection",
            "label": "Option selection",
            "status": "pass",
            "decision_effect": "promote",
            "reason": "selected best ranked scorecard option leg",
            "evidence": [
              {
                "key": "selected_option_contract",
                "value": "au2608c880",
                "source_ref": "scorecard_record:1"
              },
              {
                "key": "side",
                "value": "call",
                "source_ref": "scorecard_record:1"
              },
              {
                "key": "strike",
                "value": 880,
                "source_ref": "scorecard_record:1"
              },
              {
                "key": "dte",
                "value": 45,
                "source_ref": "scorecard_record:1"
              },
              {
                "key": "otm_rank",
                "value": 1,
                "source_ref": "scorecard_record:1"
              },
              {
                "key": "delta_estimate",
                "value": null,
                "source_ref": "scorecard_record:1"
              }
            ]
          },
          {
            "id": "iv_regime",
            "kind": "gate",
            "label": "Causal IV regime",
            "status": "blocked",
            "decision_effect": "block",
            "reason": "iv_warmup(<1 prior signals)",
            "evidence": [
              {
                "key": "iv",
                "value": 20.0,
                "source_ref": "scorecard_record:1"
              },
              {
                "key": "iv_rank",
                "value": null,
                "source_ref": "scorecard_record:1"
              },
              {
                "key": "iv_keep",
                "value": false,
                "source_ref": "scorecard_record:1"
              }
            ]
          },
          {
            "id": "premium_entry",
            "kind": "gate",
            "label": "Premium entry availability",
            "status": "pass",
            "decision_effect": "promote",
            "reason": "selected option leg has an entry price",
            "evidence": [
              {
                "key": "option_price",
                "value": 18.5,
                "source_ref": "scorecard_record:1"
              },
              {
                "key": "price_source",
                "value": "store",
                "source_ref": "scorecard_record:1"
              }
            ]
          },
          {
            "id": "exit_policy",
            "kind": "policy",
            "label": "Exit policy",
            "status": "advisory",
            "decision_effect": "annotate",
            "reason": "runner policy retained for review; final action blocked by status",
            "evidence": [
              {
                "key": "exit_mode",
                "value": "runner",
                "source_ref": "scorecard_record:1"
              },
              {
                "key": "exit_status",
                "value": "data_blocked",
                "source_ref": "scorecard_record:1"
              }
            ]
          }
        ]
      }
    },
    {
      "id": "paft_scorecard_0002_kq_m_shfe_au_20260629000000",
      "instrument": "SHFE.au",
      "contract": "kq_m_shfe_au",
      "interval": "1d",
      "ts_utc": "2026-06-29T00:00:00Z",
      "underlying_signal": {
        "family": "pa_feitian",
        "source": "score_today",